{
  "schema_version": "sidecar_evaluate_response_v1",
  "decision": "REFUSE",
  "refusal_code": "AMOUNT_LIMIT_EXCEEDED",
  "message": "payment amount exceeds configured maximum",
  "receipt_id": "0000000000000000000000000000000000000000000000000000000000000000",
  "policy_version": "1.0.0",
  "rule_ids": [
    "PAYMENT_MAX_AMOUNT_10000"
  ],
  "latency_ms": 12
}
